{
  "runId": "claim:sha256:b0bfdbbdf9e47aebd5d0508c95be8fdc4483d15ed185c02eaf15999eabc15f67",
  "runMode": "deterministic-recorded",
  "evaluationKind": "CLAIM_EXTRACTION",
  "corpusId": "shotgun-quality-baseline",
  "corpusVersion": "1.0.0",
  "corpusDigest": "sha256:b0bfdbbdf9e47aebd5d0508c95be8fdc4483d15ed185c02eaf15999eabc15f67",
  "labelSetRevision": 2,
  "evaluationContractVersion": "1.0.0",
  "applicationCommitSha": "848b9b6762339a9f58dc80a62459f420849ff613",
  "moduleVersions": {
    "intake": "1.0.0",
    "original-asset": "1.0.0",
    "transformation": "1.0.0",
    "evidence": "1.0.0",
    "ai-provider": "1.0.0",
    "candidate-generation": "1.0.0",
    "validation": "1.0.0"
  },
  "adapterVersions": {
    "fake-ai-provider": "1.0.0",
    "lucas-augmented-plain-text": "1.0.0",
    "stage2-in-memory": "1.0.0",
    "stage3-in-memory": "1.0.0",
    "stage4-in-memory": "1.0.0"
  },
  "projectorVersions": {},
  "databaseVersion": "",
  "databaseExtensionVersions": {},
  "databaseSearchConfiguration": {},
  "providerName": "fake",
  "providerAdapterVersion": "1.0.0",
  "providerModel": "shotgun-direct-copy",
  "providerModelVersion": "shotgun-direct-copy",
  "promptVersion": "direct-claim-v1",
  "policyVersion": "direct-only-v1",
  "randomSeedOrDeterministicSettings": "stage4-command-handler;fake-direct-copy;normalized-runtime-identifiers;output:sha256:5a3e44be3d2c2373a7d68221de181a9337ad4cace8ac55c1562a138b49f734c5",
  "startedAt": "2026-07-22T08:00:00.000Z",
  "completedAt": "2026-07-22T08:00:00.000Z",
  "metricImplementationVersion": "1.0.0",
  "caseResults": [
    {
      "evaluationUnitId": "duplicate-claim",
      "passed": false,
      "counts": {
        "expected": 1,
        "predicted": 2,
        "tp": 1,
        "fp": 1,
        "fn": 0,
        "unsupported": 0,
        "duplicates": 0,
        "textMatched": 1,
        "evidenceExact": 1,
        "noClaimCases": 0,
        "correctNoClaimCases": 0,
        "exactCases": 0,
        "cases": 1
      },
      "metrics": {
        "precision": {
          "numerator": 1,
          "denominator": 2,
          "value": 0.5
        },
        "recall": {
          "numerator": 1,
          "denominator": 1,
          "value": 1
        },
        "f1": {
          "numerator": 2,
          "denominator": 3,
          "value": 0.666666666667
        },
        "exactClaimMatch": {
          "numerator": 0,
          "denominator": 1,
          "value": 0
        },
        "unsupportedClaimRate": {
          "numerator": 0,
          "denominator": 2,
          "value": 0
        },
        "duplicateClaimRate": {
          "numerator": 0,
          "denominator": 2,
          "value": 0
        },
        "evidenceExactMatch": {
          "numerator": 1,
          "denominator": 1,
          "value": 1
        },
        "evidenceCoverage": {
          "numerator": 1,
          "denominator": 1,
          "value": 1
        },
        "noClaimAccuracy": {
          "numerator": 0,
          "denominator": 0,
          "value": null
        }
      },
      "failureCodes": ["EXTRACTION_FALSE_POSITIVE"]
    },
    {
      "evaluationUnitId": "en-multiple",
      "passed": true,
      "counts": {
        "expected": 2,
        "predicted": 2,
        "tp": 2,
        "fp": 0,
        "fn": 0,
        "unsupported": 0,
        "duplicates": 0,
        "textMatched": 2,
        "evidenceExact": 2,
        "noClaimCases": 0,
        "correctNoClaimCases": 0,
        "exactCases": 1,
        "cases": 1
      },
      "metrics": {
        "precision": {
          "numerator": 2,
          "denominator": 2,
          "value": 1
        },
        "recall": {
          "numerator": 2,
          "denominator": 2,
          "value": 1
        },
        "f1": {
          "numerator": 4,
          "denominator": 4,
          "value": 1
        },
        "exactClaimMatch": {
          "numerator": 1,
          "denominator": 1,
          "value": 1
        },
        "unsupportedClaimRate": {
          "numerator": 0,
          "denominator": 2,
          "value": 0
        },
        "duplicateClaimRate": {
          "numerator": 0,
          "denominator": 2,
          "value": 0
        },
        "evidenceExactMatch": {
          "numerator": 2,
          "denominator": 2,
          "value": 1
        },
        "evidenceCoverage": {
          "numerator": 2,
          "denominator": 2,
          "value": 1
        },
        "noClaimAccuracy": {
          "numerator": 0,
          "denominator": 0,
          "value": null
        }
      },
      "failureCodes": []
    },
    {
      "evaluationUnitId": "en-uncertainty",
      "passed": true,
      "counts": {
        "expected": 1,
        "predicted": 1,
        "tp": 1,
        "fp": 0,
        "fn": 0,
        "unsupported": 0,
        "duplicates": 0,
        "textMatched": 1,
        "evidenceExact": 1,
        "noClaimCases": 0,
        "correctNoClaimCases": 0,
        "exactCases": 1,
        "cases": 1
      },
      "metrics": {
        "precision": {
          "numerator": 1,
          "denominator": 1,
          "value": 1
        },
        "recall": {
          "numerator": 1,
          "denominator": 1,
          "value": 1
        },
        "f1": {
          "numerator": 2,
          "denominator": 2,
          "value": 1
        },
        "exactClaimMatch": {
          "numerator": 1,
          "denominator": 1,
          "value": 1
        },
        "unsupportedClaimRate": {
          "numerator": 0,
          "denominator": 1,
          "value": 0
        },
        "duplicateClaimRate": {
          "numerator": 0,
          "denominator": 1,
          "value": 0
        },
        "evidenceExactMatch": {
          "numerator": 1,
          "denominator": 1,
          "value": 1
        },
        "evidenceCoverage": {
          "numerator": 1,
          "denominator": 1,
          "value": 1
        },
        "noClaimAccuracy": {
          "numerator": 0,
          "denominator": 0,
          "value": null
        }
      },
      "failureCodes": []
    },
    {
      "evaluationUnitId": "evidence-gap",
      "passed": false,
      "counts": {
        "expected": 0,
        "predicted": 1,
        "tp": 0,
        "fp": 1,
        "fn": 0,
        "unsupported": 0,
        "duplicates": 0,
        "textMatched": 0,
        "evidenceExact": 0,
        "noClaimCases": 1,
        "correctNoClaimCases": 0,
        "exactCases": 0,
        "cases": 1
      },
      "metrics": {
        "precision": {
          "numerator": 0,
          "denominator": 1,
          "value": 0
        },
        "recall": {
          "numerator": 0,
          "denominator": 0,
          "value": null
        },
        "f1": {
          "numerator": 0,
          "denominator": 1,
          "value": 0
        },
        "exactClaimMatch": {
          "numerator": 0,
          "denominator": 1,
          "value": 0
        },
        "unsupportedClaimRate": {
          "numerator": 0,
          "denominator": 1,
          "value": 0
        },
        "duplicateClaimRate": {
          "numerator": 0,
          "denominator": 1,
          "value": 0
        },
        "evidenceExactMatch": {
          "numerator": 0,
          "denominator": 0,
          "value": null
        },
        "evidenceCoverage": {
          "numerator": 0,
          "denominator": 0,
          "value": null
        },
        "noClaimAccuracy": {
          "numerator": 0,
          "denominator": 1,
          "value": 0
        }
      },
      "failureCodes": ["EXTRACTION_FALSE_POSITIVE"]
    },
    {
      "evaluationUnitId": "html-derived-status",
      "passed": false,
      "counts": {
        "expected": 1,
        "predicted": 1,
        "tp": 0,
        "fp": 1,
        "fn": 1,
        "unsupported": 0,
        "duplicates": 0,
        "textMatched": 1,
        "evidenceExact": 0,
        "noClaimCases": 0,
        "correctNoClaimCases": 0,
        "exactCases": 0,
        "cases": 1
      },
      "metrics": {
        "precision": {
          "numerator": 0,
          "denominator": 1,
          "value": 0
        },
        "recall": {
          "numerator": 0,
          "denominator": 1,
          "value": 0
        },
        "f1": {
          "numerator": 0,
          "denominator": 2,
          "value": 0
        },
        "exactClaimMatch": {
          "numerator": 0,
          "denominator": 1,
          "value": 0
        },
        "unsupportedClaimRate": {
          "numerator": 0,
          "denominator": 1,
          "value": 0
        },
        "duplicateClaimRate": {
          "numerator": 0,
          "denominator": 1,
          "value": 0
        },
        "evidenceExactMatch": {
          "numerator": 0,
          "denominator": 1,
          "value": 0
        },
        "evidenceCoverage": {
          "numerator": 0,
          "denominator": 1,
          "value": 0
        },
        "noClaimAccuracy": {
          "numerator": 0,
          "denominator": 0,
          "value": null
        }
      },
      "failureCodes": ["CLAIM_MISSED", "EVIDENCE_MISMATCH", "EXTRACTION_FALSE_POSITIVE"]
    },
    {
      "evaluationUnitId": "ko-negative",
      "passed": true,
      "counts": {
        "expected": 1,
        "predicted": 1,
        "tp": 1,
        "fp": 0,
        "fn": 0,
        "unsupported": 0,
        "duplicates": 0,
        "textMatched": 1,
        "evidenceExact": 1,
        "noClaimCases": 0,
        "correctNoClaimCases": 0,
        "exactCases": 1,
        "cases": 1
      },
      "metrics": {
        "precision": {
          "numerator": 1,
          "denominator": 1,
          "value": 1
        },
        "recall": {
          "numerator": 1,
          "denominator": 1,
          "value": 1
        },
        "f1": {
          "numerator": 2,
          "denominator": 2,
          "value": 1
        },
        "exactClaimMatch": {
          "numerator": 1,